,utterance_id,utterance,labeled_utterance,avg_labeled_utterance
603,u381070,"Although she’s mostly known for making movies, Zhou Xun has portrayed a couple of classic TV characters, such as Huang Rong in Legend of the Condor Heroes and the young Princess Taiping in Palace of Desire.",1.0,1.0
604,u193940,"Youth that big-hearted source is in the beauties of nature, simple have got eternal of magic power.",4.0,4.0
605,u271316,"With ""the lover of Mrs. Cha Tailai"" the homonymic film that films for prototype and contemporary a few small compose a quarrel are narrated, sexual process by write up.",5.0,5.0
606,u162891,"Nat： Yes, and a lot of daredevil young guys run in front of the bulls to show how brave they are.",2.0,2.0
607,u279138,"Protecting our nation from the dangers of a new century requires more than good intelligence and a strong military. It also requires changing the conditions that breed resentment and allow extremists to prey on despair. So America is using its influence to build a freer, more hopeful, and more compassionate world. This is a reflection of our national interest and the calling of our conscience.",2.0,2.0
608,u436103,"Sun also suggests that students prepare some questions. ""Think about the purpose of your tour and ask questions accordingly. Even if you don't speak the local language perfectly, as long as you try to communicate with the locals, you will find them easy to get along with,"" Sun says.",1.0,1.0
609,u9916,"The intersection of politics and religion in the 2012 race for the White House came into sharp focus because of comments from an evangelical Christian pastor, Robert Jeffress, who supports Texas Governor Rick Perry for president.",2.0,2.0
610,u153889,"""OOCL offers customers comprehensive coverage of east-west trade corridors, with some of the fastest transit times in the industry.""",1.0,1.0
611,u38003,"He can see a benefit to Mr. Obama being President, especially on the world stage. “He’s the first Black President.",2.0,2.0
612,u4580,"Revelations of financial fraud and various other similar crimes, such as embezzlement and kickbacks, are not entirely irrelevant to a company’s share price.",1.0,1.0
613,u168039,"The job deform for the existence of processing combination and calorific effect in the course of machining, when the deformation is big enough the job would become discard so the article introduced some successful experience.",1.0,1.0
614,u262776,"You might experience a flipping back and forth, from one to the other, then back again, when you stare at the picture.",2.0,2.0
615,u316168,"So, do not be surprised if this assumption is invalidated in future releases, though I think the probability of that is low.",2.0,2.0
616,u157616,To enhance the reliability of operation the design quality of the control rule is one of the critical factors.,1.0,1.0
617,u392746,"75 Our activities cover a wide range of commodities, such as ties, belts and shirts.",1.0,1.0
618,u267968,Tea houses in Hangzhou trace back to the Southern Song Dynasty (1127 - 1279).,1.0,1.0
619,u237888,"You do like to launch into some utter nonsense, especially at holiday times. It's your latent masochism, I suppose.",3.0,3.0
620,u94602,"MOOCs have become highly popular in the last couple of years in the United States, where the concept evolved.",2.0,2.0
621,u175815,"A complete ophiolite section can be divided from bottom to top into four units, namely metaperidotite unit, plutonic complex unit, sheeted dike complex unit and extrusive rock unit, each unit having varied rock assemblages.",1.0,1.0
622,u394218,"At 70 years and four months old, the unstoppable granddad-of-three has beaten the current Guinness World Record held by George Brunstad, who was 70 years and four days old.",1.0,1.0
623,u354658,Image matching is the key stage for Digital Terrain Model (DTM) automatical aquisition using with digital images.,2.0,2.0
624,u127783,"Discussed in this paper are the concepts of information literacy,characteristics of information environment,and the information literacy that librarians and information personnel should possess in the information times.",1.0,1.0
625,u123533,The Ukraine security service has denied it was involved. Steve Rosenberg reports from Moscow.,3.0,3.0
626,u44862,Prime Minster Singh told a conference Thursday that attacks against women happen in all states and areas.,1.0,1.0
627,u384291,"""I think about people, and I have a conversation with them in my head, "" he says. ""But I tend to not reach out.""",1.0,1.0
628,u342142,"For the Communist party, which had been keeping a careful eye on the shifts within the Kuomintang, suddenly decided to force matters.",3.0,3.0
629,u354057,Madame Curie warned learners not to go too fast.,2.0,2.0
630,u99849,"A similar link between educational attainment and alcohol consumption is seen among men, but the correlation is less strong.",2.0,2.0
631,u247395,"If convicted, Mehanna faces up to 15 years in prison on the charge of material support of terrorism.",1.0,1.0
632,u66614,My wallpaper and I are fighting aduelto the death.One or other of us has to go.,2.0,2.0
633,u429982,"The answer remains elusive in part because love is not one thing. Love for parents, partners, children, country, neighbour, God and so on all have different qualities. Each has its variants – blind, one-sided, tragic, steadfast, fickle, reciprocated, misguided, unconditional. At its best, however, all love is a kind a passionate commitment that we nurture and develop, even though it usually arrives in our lives unbidden. That's why it is more than just a powerful feeling. Without the commitment, it is mere infatuation. Without the passion, it is mere dedication. Without nurturing, even the best can wither and die.",1.0,1.0
634,u326927,"Baroness: This really is exciting for me, George, being here with you.",1.0,1.0
635,u352697,"His fustian shirt, sanguineflowered, trembles its Spanish tassels at his secrets.",5.0,5.0
636,u417614,"“In Macau, a Brazilian has an advantage, ”Liu said, noting the ease of investing somewhere in which one of the official languages is Portuguese and which is considered to be a platform for integrating China with the Portuguese-speaking world.",2.0,2.0
637,u114586,Numbers from the UK’s Office for National Statistics indicate a similar trend across the Atlantic: the percentage of one-child families in Britain had risen from 18 percent in 1972 to 26 percent in 2007.,2.0,2.0
638,u40859,They also repeated their call for the release of one of their commanders who is in jail in the United States.,2.0,2.0
639,u198013,Marlowe's greatest achievement lies in that he perfected the blank verse and made it the principal medium of English drama.,1.0,1.0
640,u375665,The concert by Queen was a sell - out six weeks before the event.,1.0,1.0
641,u281053,The European Union had just begun deploying a peacekeeping force along Chad's border with Sudan when the rebel incursion started last week. An EU spokesman said those efforts are now expected to resume next week.,1.0,1.0
642,u790,But research just published in BMC Medicine suggests papers in open-access journals are as widely cited as those in traditional publications.,1.0,1.0
643,u8574,"The strategic partnership signed by India and Afghanistan is being seen as a major step in deepening their friendly ties. India is already one of Afghanistan's biggest donors, investing in roads, hospitals and energy projects.",1.0,1.0
644,u428293,"The problem is that there is a general (and misplaced) belief that China will always be a loser, that it can only imitate, not innovate.",1.0,1.0
645,u173068,"This paper first argues that derogatory terms can be used as brand names and then goes on to prove it through the multi-meanings of a word, the context and association.",2.0,2.0
646,u418686,"The Brazilian oil company will thus start exploration of the Tupi field a year ahead of schedule and hopes to reach a daily output of 20,000 barrels of crude oil, Gabrielli said.",1.0,1.0
647,u77335,"If you were an alien from Mars and sat in on one of these meetings, you would believe that a client's success or progress was not part of the thought process at all.",3.0,3.0
648,u344629,For injury prevention，please don't run and play in changing room.,1.0,1.0
649,u21781,"The South African government is releasing more than 14,000 prisoners to mark the anniversary of Nelson Mandela winning the country's first democratic elections in 1994. It represents about 9% of the prison population.",1.0,1.0
650,u79691,Remember to only ask these questions if it makes sense to do so (i.e. the name is unusual).,2.0,2.0
651,u87404,Federal prosecutors allege that the Black Guerrilla Family gang established a lucrative smuggling operation inside the jail under the leadership of inmate Tavon White.,1.0,1.0
652,u54213,"'To Chinese officials, the choice of food is based on the price: the more expensive, the more they are eager to eat,' he said。",1.0,1.0
653,u214770,This is why you should never complain about your life.,3.0,3.0
654,u47793,"In June, Ansar Dine turned its weapons against the lesser-armed Tuareg fighters and seized control of the area.",3.0,3.0
655,u356555,"Could I have an alarm call at 5.30 tomorrow, please?",1.0,1.0
656,u313147,These attitudes of indulging children and disrespect towards teachers should arouse more opposing voices.,2.0,2.0
657,u17558,"The expression, to take a chance on something, means that you aren't sure if it's going to work, but you are going to gamble.",1.0,1.0
658,u46867,"The swan is mostly silent through its life. It floats quietly on the water, unable to sing sweet songs like most other birds.",1.0,1.0
659,u228274,"Because I like down all day doing, on the other hand down my feeling at that time.",5.0,5.0
660,u285106,Democrats are encouraged about their chances of winning back the White House this year after eight years of Republican control under President Bush.,2.0,2.0
661,u241705,"After all, what is humor but the ability to make light of real life?",2.0,2.0
662,u418911,"The G19 is made up of Germany, Austria, Belgium, Canada, the European Commission, Denmark, Spain, Finland, France, Italy, Ireland, Norway, the Netherlands, Portugal, the United Kingdom, Sweden, Switzerland, the World Bank and the African Development Bank.",1.0,1.0
663,u197816,"There are 1000 new companies every day promising you #1 rankings, increased conversion rates overnight, blah blah blah etc. etc. BS BS BS.",1.0,1.0
664,u386933,"Mark Heard, another EVE player who goes by “Seleene,” noticed something was wrong when he saw “Vile Rat” type an expletive and then “gunfire” on the instant messaging service Jabber.",2.0,2.0
665,u243954,"In the skills of driving, Xiao Li and Xiao Wang are neck and neck.",1.0,1.0
666,u90888,"This is especially the case if you are starting something like a new exercise habit, where throwing yourself into a rigorous training regime before your body and mind are ready could result in injury and set you back more than it helps you.",2.0,2.0
667,u50287,"""Both Syrian sides have got very different objectives going into it.",4.0,4.0
668,u19441,"A machine cuts them into pieces, which are then cooled, boned and packed.",2.0,2.0
669,u365240,"It is used in breaking the fruit and vegetable of apples, pears, tomatoes, jujubes, asparagus.",4.0,4.0
670,u234263,I could still insist upon my innocence and hazard all upon a trial.,1.0,1.0
671,u54012,"But as Chinese growth moderates, Mr. Xi's government has a new priority.",3.0,3.0
672,u200669,Dropping the phone in the sink in front of my new boyfriend was a big blooper!,2.0,2.0
673,u357947,He kicked down the stand to park the bike.,1.0,1.0
674,u401522,"In total, BFA loans reached 62.3 billion kwanza, 6 billion more than BPC.",2.0,2.0
675,u836,"The results reveal that just as cold drinks lead to perceptions of social conditions being cold, tinkering with feelings of physical stability leads to perceptions of social instability.",1.0,1.0
676,u76862,"We grew up together in Maine and have said for years that we should have an annual event, yet it's oftenpostponedor canceled due to schedule conflicts.",1.0,1.0
677,u91902,Large droplets of water gather at the bottom of the leaf and surrounding branch while the clever frog remains protected.,1.0,1.0
678,u280532,"Mr. Hoon indicated a combat battalion, probably the Black Watch regiment of Scotland, could be moved northward from the relatively peaceful southeastern region where it is now headquartered.British media report the Black Watch would take over patrol duties in some towns south of Baghdad, relieving U.S. Marines who could join the fight against terrorists in the Sunni triangle northwest of the capital.",2.0,2.0
679,u318824,"The Turkish government Monday dismissed the Israeli inquiry as ""insufficient,"" and demanded an international investigation under U. N. auspices.",2,2.0
680,u427209,"Malawi currently imports 93 percent of its oil products via the ports of Beira and Nacal, in Nampula province, northern Mozambique, in tanker trucks, whilst the remainder arrives from Dar-es-Salam, in Tanzania.",1.0,1.0
681,u378630,So they did in Shiloh unto all the Israelites that came thither.,5.0,5.0
682,u199218,"About one year after the infection, a painful blister forms - 90% of the time on the lower leg – and one or more worms emerge accompanied by a burning sensation.",1.0,1.0
683,u183762,"The situation and effect of applying electrode holder without ring collector to semiclosed ferroalloy electric furnace with low-hood are introduced, its advantages and spread value are also affirmed.",1.0,1.0
684,u327127,This method is more exact than Schottky Barrier method by avoiding influence of back conductive current.,1.0,1.0
685,u425866,"Maputo, Mozambique, 22 June–German development banking group KfW, is to contribute 10 million euros to the programme for transferring resident families from the Limpopo National Park, in Mozambique's Gaza province, according to a report in Mozambican newspaper, Not ícias.",1.0,1.0
686,u279317,The president referred to recent intelligence reports that bin Laden is trying to recruit Jordanian-born terrorist Abu Musab al-Zarqawi to organize attacks outside Iraq.,2.0,2.0
687,u361938,Plans for the world's first kilometre - high building have been postponed altogether.,1.0,1.0
688,u253137,They also which saw it told them by what means he that was possessed of the devils was healed.,2.0,2.0
689,u977,But the markets heaved a collective sigh of relief as they noted that in an unprecedented move the court had referred crucial points in the case to the ECJ.,3.0,3.0
690,u354388,A 0434 Blank Tissue Paper - it can be used for wrapping a tea cake.,1.0,1.0
691,u260469,"""Men have to be able to size up a woman visually to see if she can bear babies,"" says Dr. Fisher.",2.0,2.0
692,u435181,"We went to the sixth floor of the mall, where Apple products were being sold, including an iPad 2 that was going for $700. The same iPad 2 costs $499 at an Apple store in Washington, D. C.",1.0,1.0
693,u101239,She has also studied everything from how to stitch her own wounds to how to cope with sleep deprivation and how to put out fires on board her 11.5-metre twin-mast ketch.,1.0,1.0
694,u153254,"In the application, linkage couple curves can be generated dynamically in the screen of microcomputer by structure parameters entered interactively.",1.0,1.0
695,u350874,After a long drive they finally hauled into town at dusk.,1.0,1.0
696,u208497,"I was joyfully expecting my first child, at the same time that my once - energetic. Zestful mother was losing her battle with a brain tumor.",1.0,1.0
697,u330409,"We won't have the RV for a few days, so we elect to find a nice bed and breakfast.",1.0,1.0
698,u354132,"He can cook, and he does it jolly well.",2.0,2.0
699,u57363,"Until recently, Asian customers say they have felt largely powerless in negotiations with suppliers.",2.0,2.0
700,u448229,"Pitching cars to younger buyers isn't a new thing for the auto industry, but China's demographics put a new spin on things. There are millions of Chinese under 30 who are only children, a legacy of the country's one-child policy. And these children have parents, grandparents, aunts and uncles who are eager to see them get a good start in life, says Ford Motor Co. chief of sales and marketing Jim Farley.",2.0,2.0
701,u221560,ANYONE who saw Yao Ming tumble to the floor against the Portland Trailblazers in the first round of the NBA Playoffs had to feel for the man.,2.0,2.0
702,u127266,"Results In 639 patients,the common complications included vertigo, tinitus, herps of the lip, temporary facial weakness,hypodermatic gelfoam diffluence,incision infection,blepharoptosis and cerebrospinal fluid otorhinorrhea.",1.0,1.0
703,u169322,to delimit; to mark out; to define the boundary of,1.0,1.0
704,u143892,"I am fine with relaxing them as long as we do not slide down to the6 th position, and that will take a miracle to happen, but it can still happen.",4.0,4.0
705,u312486,"Although the Nehru - Gandhi family was not, as Ms Singh states several times, aristocratic, they and their circle could certainly be snooty.",2.0,2.0
706,u238000,I lay down and share eight quotes which you can use to encourage yourself every time you think the task is too great.,1.0,1.0
707,u69503,"A video confiscated from the compound and released by the Obama administration showed Bin Laden watching pictures of himself on a TV screen, indicating that the compound was equipped with video playback equipment.",1.0,1.0
708,u48110,"The Spaniard’s decision not only represents something of a triumph for Bayern, but also for the German Bundesliga, which has lagged behind the English Premier League in terms of generating revenue.",3.0,3.0
709,u396961,Swimmers waded out of the water covering their heads. They shielded themselves under parasols and blow-up sun beds to stay clear of the giant hailstones.,1.0,1.0
710,u429112,"By contrast, when another Frenchman, the former footballer Eric Cantona, managed the New York Cosmos in a match against his old club Manchester United, he seemed to fail to understand the question: ""What will it be like in the away dugout?"" It was odd, perhaps, after his years in the game, but it shows that native speakers need to take care when talking to people for whom English is a second language.",2.0,2.0
711,u53820,Mr. Chen's supporters have argued that he should be released on medical parole.,1.0,1.0
712,u366209,Harry Truman loved to sit in an old rocker in the evenings.,1.0,1.0
713,u92277,Each interaction with another individual reflects a personal belief system and code of morality.,1.0,1.0
714,u212457,"It wouldn't have to be the formal separation that is often a legal precursor to divorce, but an informal break to give the spouses some space to breathe, think and calm down.",1.0,1.0
715,u324896,"In fact, sometimes I've been left standing as the technology bandwagon pulls away.",2.0,2.0
716,u369565,Women can achieve in areas where men traditionally have achieved.,2.0,2.0
717,u110083,"It is believed that smartphone and laptop use, could cause facial skin and muscle to lose its elasticity as people spend an increasing amount of time sat with their heads bent.",2.0,2.0
718,u375964,VHDL description can be given a comprehensive code and behavior - level description.,1.0,1.0
719,u72825,"Three is lucky because it represents the traditional family: mother, father, and child.",3.0,3.0
720,u108344,"In Wang Xuesheng's store, more than 600 paper bags with a Louis Vuitton logo, priced at 3 yuan a piece, sold within 30 days.",2.0,2.0
721,u235817,"If we judge by the latter criterion, then we are focusing on results, not on ""procedural progress "".",4.0,4.0
722,u96369,Even if he became a Martian I'd still love him.,2.0,2.0
723,u253287,"If you ’re an avoider, you need to practise relying on people, giving them a chance instead of finding fault and pulling away.",2.0,2.0
724,u249433,All his life he reached out for the truths of spirits and gods.,2.0,2.0
725,u137465,What are SOPs for dealing with landing zones? i.e.: not using wands with to marshal in the helicopter.,3.0,3.0
726,u265911,"That would require new laws in some states, however, which could take years because some civil liberties groups and lobbyists for people with AIDS oppose the changes.",3.0,3.0
727,u201708,Blvd has become a rising star in design world of China.,1.0,1.0
728,u364893,Pupation takes place abou the middle part of April.,1.0,1.0
729,u2230,"The Education Department has written a nineteen-page letter to all school systems, colleges and universities that accept federal money. It explains requirements for them under Title Nine in dealing with sexual violence.",2.0,2.0
730,u231581,"So it is fully in accord with Maslow's needs theory or Clayton Paul Alderfer's ERG theory, that these three levels of need be coexisted in every person.",4.0,4.0
731,u412211,"Businesspeople did not have enough time to prepare samples of their products as the possibility of exhibiting at the fair was only announced a few weeks ago, said Tang.“Some will take small items or just leaflets, as is the case of one company with non-branded products, ”Tang said.",1.0,1.0
732,u377542,"Land ecological model system is set up by using systematic idea, and multi - factors are analysed quantitatively.",1.0,1.0
733,u49028,"Amar Naga, the boss of the Milford facility, admits that consulting proper is so far just 2.6% of TCS's revenue.",1.0,1.0
734,u236313,"I nearby have a beauty, the name call worry Ji, she see my depressed and not talking much, she don't fear my Ai frost and often keep company with me to drink.",3.0,3.0
735,u197342,"Today, my boyfriend showed me a YouTube video of him popping a huge blackhead on his forehead.",1.0,1.0
736,u187140,"It looked like ordinary salt, but was one million times more radioactive than uranium.",1.0,1.0
737,u326879,"Redeemed by such a critical choice, they'll soar like a glider, race like a Stealth, and, when overflying a barnyard or kennel, turn into a wicked- awesome dive bomber.",3,3.0
738,u51097,"A paper published earlier this year in Naturwissenschaften, for example, showed that even small doses of neonicotinoids weakened bees' resistance to Nosema, a common fungal parasite.",1.0,1.0
739,u116645,About 50 percent thought society was a good university and about 20 percent thought a person could improve himself or herself anywhere.,2.0,2.0
740,u41421,"At Doha, they’re being asked to make further cuts.",4.0,4.0
741,u49936,The report says South Africa gives six times more money to students in areas with low education levels and high unemployment.,2.0,2.0
742,u156221,"Standing in the new century, Taiping still keeps her tenet, high-quality, creativeness and credibility, and will strive hard for further development.",1,1.0
743,u400508,The decision by the Finance Ministry and Brazilian Central Bank(BC) was approved by President Luiz In ácio Lula da Silva and the IMF has already been informed.,1.0,1.0
744,u122531,putting most of the money—roughly 8 trillion—into local and foreign shares instead.,3.0,3.0
745,u83385,He wrote that the ‘human mind is capable of excitement without the application ofgrossand violent stimulants'.,2.0,2.0
746,u63422,"Attempting a technological fix, a conscientious Japanese phone company last year began offering Android handsets that lock themselves if users attempt to use them while walking.",2.0,2.0
747,u357889,The ancient Egyptian civilization is one of the oldest in the world.,1.0,1.0
748,u93878,"More often than not, your promise is an absolute (i.e “I promise I'll always love you”), and only Sith deal in absolutes.",4.0,4.0
749,u125935,promote the orderly shift of surplus labour forces from countryside and pastureland so as to lighten the pressure of farmland.,2.0,2.0
750,u377996,The party was so dull that It'switched him off.,2.0,2.0
751,u423915,"Maputo, Mozambique, 10 Nov–Mozambique's Centre for Investment Promotion(CPI) received proposals for 149 projects in the first six months of this year with a total value of US$ 1.1 billion, a source in the organization told macauhub.",1.0,1.0
752,u142295,③Roast metamorphose of intrusive body to carbonate wall rock can form CO_(2 )gas source indirectly.,3.0,3.0
753,u86074,Top-rated schools such as Stanford and Villanova University offer online professional certification and academic degree programs to students all over the world.,1.0,1.0
754,u420039,"Cape Verde's relations with the IMF are currently governed by a Policy Support Instrument(PSI), under periodic review. In the latest report on this pact, the two parties made a positive evaluation of the program's two-year implementation, which includes fiscal, budget, financial and other measures.",1.0,1.0
755,u173968,"""I won't think of it now,"" she said desperately, burying her face in the pillow.",3.0,3.0
756,u43924,"This inauguration is likely to attract a smaller crowd -- forecast at between 600,000 and 800,000 people.",1.0,1.0
757,u288522,"With President Arroyo at his side, Mr. Bush also expressed America's condolences to the victims of the storm and their families.",1.0,1.0
758,u247614,Why? Because saving and investment depend on the level of GDP.,2.0,2.0
759,u381959,The bank also said it had revised last year's results to view a loss of more than 3.5 billion dollars instead of the previously announced profit of about the same amount.,1.0,1.0
760,u24964,The UN Secretary General Ban Ki-moon joined the chorus of international condemnation directed at the Syrian government over the weekend.,1.0,1.0
761,u22023,"Researchers at Harvard University, however, have found that there's one thing musical training does not do.",3.0,3.0
762,u434,"Russia says there is no open confrontation here, but that it has the right to defend its people and interests in Ukraine.",4.0,4.0
